{
  "$schema": "https://json-schema.org/draft/2020-12/schema",
  "$id": "https://alvaropanizo.github.io/portfolio/schemas/home.schema.json",
  "title": "Portfolio homepage content",
  "description": "Contract for _data/home.json. Carousel cards are a discriminated union on \"type\" and must declare topic_id (pillar tag).",
  "type": "object",
  "additionalProperties": false,
  "required": [
    "meta",
    "header",
    "about",
    "experience_section",
    "experience_topics",
    "experiences",
    "footer"
  ],
  "properties": {
    "meta": { "$ref": "#/$defs/Meta" },
    "header": { "$ref": "#/$defs/Header" },
    "about": { "$ref": "#/$defs/About" },
    "experience_section": { "$ref": "#/$defs/ExperienceSection" },
    "experience_topics": { "$ref": "#/$defs/ExperienceTopics" },
    "experiences": {
      "type": "array",
      "minItems": 1,
      "items": { "$ref": "#/$defs/Experience" }
    },
    "footer": { "$ref": "#/$defs/Footer" }
  },
  "$defs": {
    "ExperienceTopicId": {
      "type": "string",
      "enum": ["leading_teams", "technical_depth", "product_thinking"]
    },
    "ExperienceTopic": {
      "type": "object",
      "additionalProperties": false,
      "required": ["id", "label"],
      "properties": {
        "id": { "$ref": "#/$defs/ExperienceTopicId" },
        "label": { "type": "string", "minLength": 1 },
        "short_label": { "type": "string", "minLength": 1 }
      }
    },
    "ExperienceTopics": {
      "type": "array",
      "minItems": 3,
      "maxItems": 3,
      "items": { "$ref": "#/$defs/ExperienceTopic" },
      "allOf": [
        {
          "contains": {
            "type": "object",
            "required": ["id"],
            "properties": { "id": { "const": "leading_teams" } }
          }
        },
        {
          "contains": {
            "type": "object",
            "required": ["id"],
            "properties": { "id": { "const": "technical_depth" } }
          }
        },
        {
          "contains": {
            "type": "object",
            "required": ["id"],
            "properties": { "id": { "const": "product_thinking" } }
          }
        }
      ]
    },
    "Meta": {
      "type": "object",
      "additionalProperties": false,
      "required": ["title", "description", "keywords", "og_image"],
      "properties": {
        "title": { "type": "string", "minLength": 1 },
        "description": { "type": "string" },
        "keywords": { "type": "string" },
        "og_image": { "type": "string" }
      }
    },
    "Header": {
      "type": "object",
      "additionalProperties": false,
      "required": [
        "live_status_label",
        "current_work",
        "latest_article",
        "hero"
      ],
      "properties": {
        "live_status_label": { "type": "string" },
        "current_work": {
          "type": "object",
          "additionalProperties": false,
          "required": ["label", "logo", "logo_alt", "text_html"],
          "properties": {
            "label": { "type": "string", "minLength": 1 },
            "logo": { "$ref": "#/$defs/AssetPath" },
            "logo_alt": { "type": "string", "minLength": 1 },
            "text_html": { "type": "string" }
          }
        },
        "latest_article": {
          "type": "object",
          "additionalProperties": false,
          "required": ["label", "icon", "icon_alt", "url", "title"],
          "properties": {
            "label": { "type": "string", "minLength": 1 },
            "icon": { "$ref": "#/$defs/AssetPath" },
            "icon_alt": { "type": "string", "minLength": 1 },
            "url": { "type": "string", "minLength": 1 },
            "title": { "type": "string", "minLength": 1 }
          }
        },
        "hero": {
          "type": "object",
          "additionalProperties": false,
          "required": ["name_vertical", "name_horizontal", "video", "tagline_lines"],
          "properties": {
            "name_vertical": { "type": "string", "minLength": 1 },
            "name_horizontal": { "type": "string", "minLength": 1 },
            "video": {
              "type": "object",
              "additionalProperties": false,
              "required": ["alt"],
              "properties": {
                "src": { "$ref": "#/$defs/AssetPath" },
                "src_webm": { "$ref": "#/$defs/AssetPath" },
                "boomerang": { "type": "boolean" },
                "alt": { "type": "string", "minLength": 1 }
              },
              "anyOf": [
                { "required": ["src"] },
                { "required": ["src_webm"] }
              ]
            },
            "tagline_lines": {
              "type": "array",
              "minItems": 1,
              "items": {
                "type": "object",
                "additionalProperties": false,
                "required": ["text", "emphasis"],
                "properties": {
                  "text": { "type": "string", "minLength": 1 },
                  "emphasis": { "type": "boolean" },
                  "handwritten": { "type": "boolean" }
                }
              }
            }
          }
        }
      }
    },
    "About": {
      "type": "object",
      "additionalProperties": false,
      "required": ["emphasis_phrase", "intro_paragraphs"],
      "properties": {
        "emphasis_phrase": { "type": "string", "minLength": 1 },
        "intro_paragraphs": {
          "type": "array",
          "minItems": 1,
          "items": { "type": "string", "minLength": 1 }
        }
      }
    },
    "ExperienceSection": {
      "type": "object",
      "additionalProperties": false,
      "required": ["texture_title", "heading"],
      "properties": {
        "texture_title": { "type": "string", "minLength": 1 },
        "heading": { "type": "string", "minLength": 1 }
      }
    },
    "Experience": {
      "type": "object",
      "additionalProperties": false,
      "required": [
        "id",
        "title",
        "subtitle",
        "feature_image",
        "body_paragraphs_html",
        "carousel_aria_label",
        "cards"
      ],
      "properties": {
        "id": { "type": "string", "pattern": "^[0-9]{2}$" },
        "title": { "type": "string", "minLength": 1 },
        "subtitle": { "type": "string" },
        "feature_image": { "$ref": "#/$defs/AssetPath" },
        "body_paragraphs_html": {
          "type": "array",
          "minItems": 1,
          "items": { "type": "string" }
        },
        "carousel_aria_label": { "type": "string", "minLength": 1 },
        "cards": {
          "type": "array",
          "minItems": 1,
          "items": { "$ref": "#/$defs/CarouselCard" }
        }
      }
    },
    "Footer": {
      "type": "object",
      "additionalProperties": false,
      "required": [
        "cta_lines_html",
        "linkedin_url",
        "cv_href",
        "about_title",
        "about_body_html"
      ],
      "properties": {
        "cta_lines_html": {
          "type": "array",
          "items": { "type": "string" }
        },
        "linkedin_url": { "type": "string", "minLength": 1 },
        "cv_href": { "$ref": "#/$defs/AssetPath" },
        "about_title": { "type": "string", "minLength": 1 },
        "about_body_html": { "type": "string" }
      }
    },
    "AssetPath": {
      "type": "string",
      "pattern": "^(/|https?://).+"
    },
    "PlaybookCardShort": {
      "type": "object",
      "additionalProperties": false,
      "properties": {
        "title": { "type": "string", "minLength": 1 },
        "caption": { "type": "string" },
        "visual_image": { "$ref": "#/$defs/AssetPath" },
        "visual_alt": { "type": "string" }
      }
    },
    "PlaybookCardDetail": {
      "type": "object",
      "additionalProperties": false,
      "properties": {
        "meta": { "type": "string" },
        "body_html": { "type": "string" },
        "action_label": { "type": "string" },
        "action_url": { "type": "string", "minLength": 1 }
      }
    },
    "CarouselCard": {
      "oneOf": [
        { "$ref": "#/$defs/CardPhoto" },
        { "$ref": "#/$defs/CardGeneral" },
        { "$ref": "#/$defs/CardArticle" },
        { "$ref": "#/$defs/CardQuote" },
        { "$ref": "#/$defs/CardCertificate" },
        { "$ref": "#/$defs/CardVideo" }
      ]
    },
    "CardPhoto": {
      "type": "object",
      "additionalProperties": false,
      "required": ["type", "topic_id", "image", "image_alt", "caption_html"],
      "properties": {
        "type": { "const": "photo" },
        "topic_id": { "$ref": "#/$defs/ExperienceTopicId" },
        "image": { "$ref": "#/$defs/AssetPath" },
        "image_alt": { "type": "string", "minLength": 1 },
        "caption_html": { "type": "string" },
        "id": { "type": "string", "minLength": 1 },
        "category_label": { "type": "string", "minLength": 1 },
        "type_label": { "type": "string", "minLength": 1 },
        "badge_icon": { "$ref": "#/$defs/AssetPath" },
        "short": { "$ref": "#/$defs/PlaybookCardShort" },
        "detail": { "$ref": "#/$defs/PlaybookCardDetail" }
      }
    },
    "CardGeneral": {
      "type": "object",
      "additionalProperties": false,
      "required": ["type", "topic_id", "image", "image_alt", "body_html"],
      "properties": {
        "type": { "const": "general" },
        "topic_id": { "$ref": "#/$defs/ExperienceTopicId" },
        "image": { "$ref": "#/$defs/AssetPath" },
        "image_alt": { "type": "string", "minLength": 1 },
        "body_html": { "type": "string" }
      }
    },
    "CardArticle": {
      "type": "object",
      "additionalProperties": false,
      "required": ["type", "topic_id", "url", "title", "thumbnail"],
      "properties": {
        "type": { "const": "article" },
        "topic_id": { "$ref": "#/$defs/ExperienceTopicId" },
        "url": { "type": "string", "minLength": 1 },
        "title": { "type": "string", "minLength": 1 },
        "thumbnail": { "$ref": "#/$defs/AssetPath" },
        "label": { "type": "string", "minLength": 1 },
        "image_alt": { "type": "string", "minLength": 1 },
        "id": { "type": "string", "minLength": 1 },
        "category_label": { "type": "string", "minLength": 1 },
        "type_label": { "type": "string", "minLength": 1 },
        "badge_icon": { "$ref": "#/$defs/AssetPath" },
        "short": { "$ref": "#/$defs/PlaybookCardShort" },
        "detail": { "$ref": "#/$defs/PlaybookCardDetail" }
      }
    },
    "CardQuote": {
      "type": "object",
      "additionalProperties": false,
      "required": ["type", "topic_id", "icon", "quote_html", "attribution_html"],
      "properties": {
        "type": { "const": "quote" },
        "topic_id": { "$ref": "#/$defs/ExperienceTopicId" },
        "icon": { "type": "string", "minLength": 1 },
        "quote_html": { "type": "string" },
        "attribution_html": { "type": "string" },
        "id": { "type": "string", "minLength": 1 },
        "category_label": { "type": "string", "minLength": 1 },
        "type_label": { "type": "string", "minLength": 1 },
        "badge_icon": { "$ref": "#/$defs/AssetPath" },
        "short": { "$ref": "#/$defs/PlaybookCardShort" },
        "detail": { "$ref": "#/$defs/PlaybookCardDetail" }
      }
    },
    "CardCertificate": {
      "type": "object",
      "additionalProperties": false,
      "required": [
        "type",
        "topic_id",
        "mark_image",
        "mark_alt",
        "title_html",
        "issuer_html"
      ],
      "properties": {
        "type": { "const": "certificate" },
        "topic_id": { "$ref": "#/$defs/ExperienceTopicId" },
        "mark_image": { "$ref": "#/$defs/AssetPath" },
        "mark_alt": { "type": "string", "minLength": 1 },
        "title_html": { "type": "string" },
        "issuer_html": { "type": "string" },
        "id": { "type": "string", "minLength": 1 },
        "category_label": { "type": "string", "minLength": 1 },
        "type_label": { "type": "string", "minLength": 1 },
        "badge_icon": { "$ref": "#/$defs/AssetPath" },
        "short": { "$ref": "#/$defs/PlaybookCardShort" },
        "detail": { "$ref": "#/$defs/PlaybookCardDetail" }
      }
    },
    "CardVideo": {
      "type": "object",
      "additionalProperties": false,
      "required": ["type", "topic_id", "embed_url", "iframe_title", "caption_html"],
      "properties": {
        "type": { "const": "video" },
        "topic_id": { "$ref": "#/$defs/ExperienceTopicId" },
        "embed_url": { "type": "string", "minLength": 1 },
        "iframe_title": { "type": "string", "minLength": 1 },
        "caption_html": { "type": "string" },
        "id": { "type": "string", "minLength": 1 },
        "category_label": { "type": "string", "minLength": 1 },
        "type_label": { "type": "string", "minLength": 1 },
        "badge_icon": { "$ref": "#/$defs/AssetPath" },
        "short": { "$ref": "#/$defs/PlaybookCardShort" },
        "detail": { "$ref": "#/$defs/PlaybookCardDetail" }
      }
    }
  }
}
