{
  "meta": {
    "title": "Alvaro Panizo",
    "description": "Alvaro Panizo. Senior Product Engineer. Product Manager. Information retrieval and architecture expert. Backend and Data architecture and senior development.",
    "keywords": "",
    "og_image": ""
  },
  "header": {
    "live_status_label": "—",
    "current_work": {
      "label": "CURRENTLY",
      "logo": "/assets/images/logo-actual.png",
      "logo_alt": "Oracle NetSuite logo",
      "text_html": "Product @Oracle NetSuite"
    },
    "latest_article": {
      "label": "Latest Article",
      "icon": "/assets/images/medium-icon.png",
      "icon_alt": "Medium",
      "url": "https://medium.com/empathyco/explainability-and-understanding-in-e-commerce-the-challenge-of-xai-2361b2e161ae",
      "title": "Explainability and reasoning in AI integrations"
    },
    "hero": {
      "name_vertical": "ALVARO",
      "name_horizontal": "PANIZO",
      "video": {
        "src": "/assets/videos/profile-hair-bck.mp4",
        "src_webm": "/assets/videos/profile-hair-loop.webm",
        "boomerang": true,
        "alt": "Alvaro Panizo portrait animation"
      },
      "tagline_lines": [
        {
          "text": "CONNECTING PRODUCT, ENGINEERING, AND CREATIVITY",
          "emphasis": false
        },
        {
          "text": "Product Manager",
          "emphasis": true
        },
        {
          "text": "Senior Software Engineer",
          "emphasis": true
        }
      ]
    }
  },
  "about": {
    "emphasis_phrase": "in between.",
    "intro_paragraphs": [
      "Some people decide how a product should look.",
      "Others write the code that makes it real.",
      "I've always lived somewhere in between."
    ]
  },
  "experience_section": {
    "texture_title": "My playbook",
    "heading": "How I work"
  },
  "experience_topics": [
    {
      "id": "leading_teams",
      "label": "Leading high-performing teams",
      "short_label": "Leadership"
    },
    {
      "id": "technical_depth",
      "label": "Technical depth",
      "short_label": "Engineering"
    },
    {
      "id": "product_thinking",
      "label": "Product thinking",
      "short_label": "Product"
    }
  ],
  "experiences": [
    {
      "id": "01",
      "title": "Technical Depth",
      "subtitle": "Senior Software Engineer / Data and Search",
      "feature_image": "/assets/images/playbook2.jpeg",
      "body_paragraphs_html": [
        "I write code when needed, but my real focus is building systems that last.",
        "<strong>Architecture</strong> I design search, data, and cloud systems that stay observable, scalable, and straightforward to operate.",
        "<strong>Hands-on Delivery</strong> I move comfortably from product decisions to Java, APIs, streaming pipelines, and production troubleshooting."
      ],
      "carousel_aria_label": "Technical depth highlights",
      "cards": [
        {
          "id": "photo-technical-depth",
          "type": "photo",
          "topic_id": "technical_depth",
          "category_label": "Technical depth",
          "type_label": "Highlight",
          "badge_icon": "/assets/images/playbook/icons/photo.svg",
          "image": "/assets/images/tech-expertise.png",
          "image_alt": "Alvaro Panizo",
          "caption_html": "Hands-on engineering background across search, data platforms, APIs, and cloud-native delivery—keeping systems observable and evolvable.",
          "short": {
            "title": "Search, data platforms, and cloud-native delivery"
          },
          "detail": {
            "meta": "Technical depth",
            "body_html": "Hands-on engineering background across search, data platforms, APIs, and cloud-native delivery—keeping systems observable and evolvable."
          }
        },
        {
          "id": "quote-productivity-standards",
          "type": "quote",
          "topic_id": "technical_depth",
          "category_label": "Technical depth",
          "type_label": "Quote",
          "badge_icon": "/assets/images/playbook/icons/quote.svg",
          "icon": "format_quote",
          "quote_html": "\"Álvaro produces a high volume of work while consistently maintaining high standards for quality and accuracy. He possesses the ultimate 'can do' attitude while taking on all tasks with a positive energy and a smile.\"",
          "attribution_html": "Engineering Lead · former manager, 2019–2023",
          "short": {
            "title": "High volume of work while consistently maintaining high standards",
            "visual_image": "/assets/images/playbook/quote2.png",
            "visual_alt": ""
          },
          "detail": {
            "meta": "Engineering Lead · former manager, 2019–2023",
            "body_html": "<p>I have worked very closely with Álvaro during a couple of years. Álvaro has excelled in this role, exhibiting one of the highest levels of productivity of the team. Álvaro produces a high volume of work while consistently maintaining high standards for quality and accuracy.</p><p>Álvaro possesses the ultimate \"can do\" attitude while taking on all tasks with a positive energy and a smile. His upbeat personality and engaging personal style enable him to interact effectively with clients and staff.</p><p>All the intangibles that lead to success in the workplace are in order with Álvaro. There will be no unpleasant surprises and I am confident he will fit in and add to any office morale.</p>"
          }
        },
        {
          "id": "cert-oracle-ai-vector",
          "type": "certificate",
          "topic_id": "technical_depth",
          "category_label": "Technical depth",
          "type_label": "Certification",
          "badge_icon": "/assets/images/playbook/icons/certificate.svg",
          "mark_image": "/assets/images/logo-actual.png",
          "mark_alt": "Oracle",
          "title_html": "Oracle AI Vector Search Professional",
          "issuer_html": "Oracle",
          "short": {
            "title": "Oracle AI Vector Search Professional",
            "caption": "Oracle",
            "visual_image": "/assets/images/logo-actual.png",
            "visual_alt": "Oracle"
          },
          "detail": {
            "meta": "Oracle · 2025"
          }
        },
        {
          "id": "cert-cloud-associate",
          "type": "certificate",
          "topic_id": "technical_depth",
          "category_label": "Technical depth",
          "type_label": "Certification",
          "badge_icon": "/assets/images/playbook/icons/certificate.svg",
          "mark_image": "/assets/images/articles_1.png",
          "mark_alt": "Cloud platforms",
          "title_html": "Cloud Associate",
          "issuer_html": "AWS, Google, Microsoft, Kubernetes",
          "short": {
            "title": "Cloud Associate",
            "caption": "AWS, Google, Microsoft, Kubernetes",
            "visual_image": "/assets/images/articles_1.png",
            "visual_alt": "Cloud platforms"
          },
          "detail": {
            "meta": "AWS, Google, Microsoft, Kubernetes · 2020–2026"
          }
        },
        {
          "id": "cert-software-engineering-graduate",
          "type": "certificate",
          "topic_id": "technical_depth",
          "category_label": "Technical depth",
          "type_label": "Certification",
          "badge_icon": "/assets/images/playbook/icons/certificate.svg",
          "mark_image": "/assets/images/playbook/icons/certificate.svg",
          "mark_alt": "Universidad de Oviedo",
          "title_html": "Software Engineering — Graduate",
          "issuer_html": "Universidad de Oviedo",
          "short": {
            "title": "Software Engineering — Graduate",
            "caption": "Universidad de Oviedo",
            "visual_image": "/assets/images/playbook/icons/certificate.svg",
            "visual_alt": "Universidad de Oviedo"
          },
          "detail": {
            "meta": "Universidad de Oviedo · 2016"
          }
        },
        {
          "id": "video-spark-k8s",
          "type": "video",
          "topic_id": "technical_depth",
          "category_label": "Technical depth",
          "type_label": "Video",
          "badge_icon": "/assets/images/playbook/icons/video.svg",
          "embed_url": "https://www.youtube-nocookie.com/embed/wK01Fpp6L6k",
          "iframe_title": "Running Apache Spark on K8s: From AWS EMR to K8s",
          "caption_html": "Technical talk · Berlin Buzzwords",
          "short": {
            "title": "Running Apache Spark on K8s: From AWS EMR to K8s",
            "caption": "Technical talk",
            "visual_image": "https://img.youtube.com/vi/wK01Fpp6L6k/hqdefault.jpg",
            "visual_alt": "Running Apache Spark on K8s talk thumbnail"
          },
          "detail": {
            "meta": "Berlin Buzzwords",
            "action_label": "Watch",
            "action_url": "https://www.youtube-nocookie.com/embed/wK01Fpp6L6k"
          }
        },
        {
          "id": "article-spark-performance",
          "type": "article",
          "topic_id": "technical_depth",
          "category_label": "Technical depth",
          "type_label": "Article",
          "badge_icon": "/assets/images/playbook/icons/article.svg",
          "label": "Article / Blog post",
          "url": "https://medium.com/empathyco/improving-performance-in-spark-jobs-8a60a56327da",
          "title": "Improving performance in Spark jobs",
          "thumbnail": "/assets/images/medium-icon.png",
          "image_alt": "Medium article cover",
          "short": {
            "title": "Improving performance in Spark jobs",
            "caption": "Medium · Empathy.co",
            "visual_image": "/assets/images/medium-icon.png",
            "visual_alt": "Medium"
          },
          "detail": {
            "meta": "Medium / Empathy.co",
            "action_label": "Read article",
            "action_url": "https://medium.com/empathyco/improving-performance-in-spark-jobs-8a60a56327da"